Performance Efficiency,Capacity,Is page loading performance acceptable over modems of different speeds?
Performance Efficiency,Capacity,How reliable is the system under heavy work load?(Reliability)
Performance Efficiency,Capacity,"Is the system scalable so that it can be upgraded in the future to accommodate the projected growth, without creating per item processing costs?"
Performance Efficiency,Capacity,"To check whether the system can handle the gradual increase in volume of data, by keeping the load (no of users) constant."
Performance Efficiency,Capacity,Will the site allow for large orders without locking out inventory if the transaction is invalid?
Performance Efficiency,Capacity,Can the site sustain large transactions without crashing?
Performance Efficiency,Capacity,Is the system is run with maximum amounts of data?