Transferability,Adaptability,Does the application adapt to all hardware,software ?
Transferability,Adaptability,Does the application adapt to all software platform ?
Transferability,Adaptability,Does the application adapt  to all standard language?
Transferability,Adaptability,Are concurrent users are able to access the software?
Transferability,Adaptability,Does the technology exist to develop all elements of the system?
Transferability,Adaptability,Does the system rely on proven technologies?
Transferability,Adaptability,Are function and performance assured?
Transferability,Adaptability,Can the configuration be adequately maintained?
Transferability,Adaptability,What is the risk associated with the Adaptability?
Transferability,Adaptability,Does a failure of adaption on every field cause a sensible user error message?
Transferability,Adaptability,Is the system  required to add any component in order to adapt to a new software?
Transferability,Adaptability,Have any product got  adaptation  rules and if so are all rules being applied?	"
Transferability,Adaptability,Have all the dependices been put in the developing software in order to adapt in all environments?
Transferability,Adaptability,External and internal  memory are provided  properly using memoy management ?
Transferability,Adaptability,Does the application using the common communication channel to improve adaptability?
Transferability,Adaptability,Is it easy to translate the product without having any ambiguity?
Transferability,Adaptability,Does the application provide the basic information about the software parameters required to adaptation?
Transferability,Installability,Does the application is opensource or lincesed ?
Transferability,Installability,Does the application is able to install in all environment?
Transferability,Installability,Is it compatible to 32bit and 64 bit ?
Transferability,Installability,Does the  application meet the all the browser requirements?
Transferability,Installability,Does the  application meet the all the operating system requirements?
Transferability,Installability,Does the application meet all the memory and RAM requirements?
Transferability,Installability,Have all the installtion procedures been correctly stated and understood ?
Transferability,Installability,Have all the uninstalltion procedures been correctly stated and understood ?
Transferability,Installability,Is the application requires to access from Admin while  installing and uninstalling?
Transferability,Installability,Have all the basic and secondary requirements been correctly presented prior to installing and unstalling ?"
Transferability,Installability,What is the current Service Level Objectives (SLO) that you have set for your IT infrastructure?"
Transferability,Installability,What do you measure and track the installtion time? (This would help us structure Service Levels for you with your business IT users)"
Transferability,Installability,Do you have your installtion components covered under a product / service warranty or Hardware contracts?"
Transferability,Installability,Does your organization have a installion  plan or sites / organization from an IT perspective?
Transferability,Installability,Are there currently any single point of installion  failures in your IT infrastructure,with respect to the service levels and uptime expectations? "
Transferability,Installability,What applications in your IT infrastructure would you term as  ""Essay to install? Do they follow certain producers ?"
Transferability,Installability,What applications in your IT infrastructure would you term as ""Difficult to install"" Do they follow certain producers ?"
Transferability,Installability,How frequent the installed software is used for development ?
Transferability,Installability,How much time enduring to install the software ? Transferability,Installability,
Transferability,Installability,Are there any two way or three way authentication available to authenticate users ( other mechanisms are used (e.g. certificates,token, biometric, etc)"
Transferability,Installability,Is the system administrator given the priviledge to include or exclude certain modules within the application?
Transferability,Installability,Is there a connection medium used to establish the remote support (Eg: VPN, Dail-UP, BtoB VPN using IPSEC)?"
Transferability,Installability,Do we have the internet  Usage policy?
Transferability,Installability,Are there well defined protocols for the WLAN?
Transferability,Installability,Is the contract between the network provider and LTI is well defined protection mechanism  in relation to insatllation ?"
Transferability,Installability,Is there a way to ensure all the devices such as laptop and desktop are up to date?
Transferability,Installability,Are  required standards defined for patch management?
Transferability,Installability,can parts of the product be re-used elsewhere?
Transferability,Replaceability,Are the replaceable procedures  specified are meaningful and do they address the root cause?"
Transferability,Replaceability,How do the end-users and managers feel about the problem while replacing the application?"
Transferability,Replaceability,Does the applcation is able to replace in all earlier specified environment?
Transferability,Replaceability,What skills will operators need to be trained in? 
Transferability,Replaceability,What tools are required to support to replace the product? 
Transferability,Replaceability,Does the replacing component available? Do we get  same output  in all the environments?
Transferability,Replaceability,Is it  necessary to apply methodology to analyze software replaceability and guide building replaceable system at the beginning of  phase?
Transferability,Replaceability,Is there schedule overrun and is it  analyzed & controlled ?
Transferability,Replaceability,"Are action identified/Implemented for Client feedback, Complaint, CSI ?"
Transferability,Replaceability,Is replacing  work planning  available with responsibility assigned for each task ?
Transferability,Replaceability,Is  communication frequency defined about the replacement?
Transferability,Replaceability,Is there effort overrun and is it  analyzed & controlled ?
Transferability,Replaceability,Is there schedule overrun and is it  analyzed & controlled ?
Transferability,Replaceability,Is the replacement task well placed to achieve all contractual commitments (technical/Non technical ?
Transferability,Replaceability,How is the work products replacment happening? Are they sufficiently checked and confirmed about application ussage before replacing?"
Transferability,Replaceability,Are the replacing products checked/audited by the quality personnel before the replacing in client system?"
Transferability,Replaceability,Is there sufficient time to perform the replacing of the modules as planned? 
Transferability,Replaceability,Is there stability in the functionality and design in other modules , while the replacing  is in progress?"
Transferability,Replaceability,"Does the development team have enough experience in the replacing  technology, platform or tools? "
Transferability,Replaceability,Is there a mechanism to identify the vulnerabilities?
Transferability,Replaceability,Does the product comply with common interfaces or official standards?
Transferability,Replaceability,Are there back-up and retrieval process in place for critical data?
Transferability,Replaceability,Do we have data retention policy in place (both hard and soft copies) in order to install the new software?"
Functional Stability,Completeness,Has the scope and out of scope bean properly defined ?
Functional Stability,Completeness,Have the requirements bean aligned with the business problem and properly captured and understood ?
Functional Stability,Completeness,Have the requirements been put into user stories convering the smallest unit possible of business ?
Functional Stability,Completeness,Have the dependencies between user stories correctly stated ?
Functional Stability,Completeness,Are the postive and negative flow of user stories covered for exception handling ?
Functional Stability,Completeness,Is the workflow completely defined in terms of user stories ?
Functional Stability,Completeness,Have the non-functional requirements been correctly stated and understood ?
Functional Stability,Completeness,Is the requirement traceability matrix maintained and upto date ?
Functional Stability,Completeness,Has the business problem been correctly stated and understood by stakeholders ?
Functional Stability,Completeness,Whether the Quality requirements of the product are obtained?
Functional Stability,Completeness,Whether the authentication functionality is working as per expectation?
Functional Stability,Completeness,Whether are requirements are allocated to one or more functions to implement it?
Functional Stability,Completeness,Whether the Allocated requirements are documented in lower level requirements documents or specifications that apply to parts of a project?
Functional Stability,Completeness,Whether  the larger functions are divided into different tasks ?
Functional Stability,Completeness,Whether the inputs and outputs that are identified for functions are obtained?
Functional Stability,Correctness,Is each user story / use case mapped to test scenario / test case and througly tested
Functional Stability,Correctness,"Is the incoming and outgoing connectivity well defined , so that system is compatible with the interfaces ?"
Functional Stability,Correctness,Is this a zero defect delivery ?
Functional Stability,Correctness,"Is the level of known issues / defects defined , understood and accepted by the client ?"
Functional Stability,Correctness,Whether the newly added requirement are added to userstories?
Functional Stability,Correctness,Whether the inputs and outputs that are not obtained are corrected based on requirements?
Functional Stability,Correctness,Whether the design/requirement contains error flow?
Functional Stability,Appropriateness,Has the functional aspect as well as technical aspect of user stories been properly tested and documented ?
Functional Stability,Appropriateness,Is the level of exposure of data completely defined for different user profiles ?
Functional Stability,Appropriateness,Are the risks well defined in terms of complaince with upcoming / existing regulations and compatibilit with technicl architecture ?
Functional Stability,Appropriateness,Are the user stories in line with legal / regulatory environment ?
Functional Stability,Appropriateness,Are the user stories in line with industry / region standards and standard catalogues ?
Functional Stability,Appropriateness,Is the user administration taken care of ?
Usability,Accessibility,Are all the field prompts spelt correctly?,,,
Usability,Accessibility,Is all the micro help text spelt correctly on this screen?,,,
Usability,Accessibility,Is all validation/error messages spelt correctly?,,,
Usability,Accessibility,Is all user input captured in upper/lower/both case consistently?,,,
Usability,Accessibility,"If a field has default value, then is that displayed in screen?",,,
Usability,Accessibility,Are appropriate page specific buttons and general operational buttons are available for each page?,,,
Usability,Accessibility,Is there any unused control/label?,,,
Usability,Accessibility ,Are labels and names indicate technical terms or user understandable words?,,,
Usability,Accessibility ,"Whether option boxes, option buttons and command buttons are logically grouped together in clearly demarcated areas?",,,
Usability,Accessibility ,"While designing a screen to address one requirement, is there any need of new screen/requirement (implicit) arises so that the screen is user friendly, which need to be estimated (example – search option in case of huge list in combo box)?",,,
Usability,Accessibility ,Whether user can perform intended function of the page without anybody’s help? If 'no' then required help is provided in the same page?,,,
Usability,Accessibility ,Is 'Search' and 'Sorting' facility addressed on needing base? (Alphabetic sorting is the default unless otherwise specified),,,
Usability,Accessibility ,Are controls having proper length and width so that their labels are clear without truncation (for different monitor size)?,,,
Usability,Appropriateness Recognizability,"When there is a preferable range of value/s available in screen, are they selected by default or highlighted in some way so that user understands it?",,,
Usability,Appropriateness Recognizability,"There are few options available for selection in screen and as per requirement majority of users select a particular option, then by default that value/s is/are selected?",,,
Usability,Appropriateness Recognizability,"When there are multiple rows for selection, ‘Select/unselect All’ option is provided?",,,
Usability,Appropriateness Recognizability,"Is common name used for same entity across pages?
Usability,Appropriateness Recognizability,"When 2 or more screen are having the same set of data for display/user input, whether they look alike with respect to grouping of data, placement, color etc?",,,
Usability,Appropriateness Recognizability,Does home page has information on overall application /resolution /company information?,,,
Usability,Appropriateness Recognizability,"Are status of different items/tasks indicated based on relevance in screen?
Usability,Appropriateness Recognizability,"If user task is pending on any item, then whether are indications available in screen for logged in used, based on action to be done?
Usability,Appropriateness Recognizability,"Is there any alert available for logged in user based on relevance/requirement?
Usability,Appropriateness Recognizability,"If functionality in a screen requires any document as reference while filling the details, then provision to keep it open and then fill the details is available?
Usability,Appropriateness Recognizability,Is change of screen resolution is affecting the application drastically? If 'yes' then proper information is conveyed to user? ,,,
Usability,Appropriateness Recognizability,Is (minimum) Online Help available to the user for all basic commands and controls?,,,
Usability,Appropriateness Recognizability,Are all read-only fields avoided in the TAB sequence? ,,,
Usability,Appropriateness Recognizability,Are all disabled fields avoided in the TAB sequence?,,,
Usability,Appropriateness Recognizability,Are the screen and field colors adjusted correctly for read-only mode (user is able to identify read-only fields in screen)?,,,
Usability,Appropriateness Recognizability,Are all fields and controls disabled in read-only mode (Are validations are not removed in screen for read only controls and fields?)?,,,
Usability,Appropriateness Recognizability,Whether components are enabled/disabled based on need?,,,
Usability,Appropriateness Recognizability,For View only screens whether text boxes or other controls editable or clickable?,,,
Usability,Appropriateness Recognizability,BreadCrums: Using should know the navigations how he ends at the respective page and should also go back to a step navigation?,,,
Usability,Appropriateness Recognizability,Help pages when needed for complex functionality and help icons should be easily seen next to the headers,,,
Usability,Appropriateness Recognizability,"Uniform design,Indentations,Pages and similar colors & fonts across pages.",,,
Usability,Appropriateness Recognizability,Have used google Analytics or tools to check the navigation flow by users and page hits?,,,
Usability,Appropriateness Recognizability,Is UI according to targeted Age group?   Ex: If the product is for old age users then it should be easily understanding for all the help pages,,,
Usability,Appropriateness Recognizability ,How easy is to change the themes of the page and usage of SCSS,,,
Usability,Appropriateness Recognizability ,Are navigation of pages happening from pop-ups?,,,
Usability,Appropriateness Recognizability ,Is proper User error handling mechanism implemented & used in all pages?,,,
Usability,Appropriateness Recognizability ,"If custom tags are used, then what all are the attributes.",,,
Usability,Appropriateness Recognizability ,The application installs easily in a minimum number of steps,,,
Usability,Appropriateness Recognizability ,"The installation of application is self explanatory, in case it needs assistance then Installation Guideline is provided.",,,
Usability,Learnability ,"Installation guideline goes step by step, in exact way application has to be installed, giving the action by the person doing installation.",,,
Usability,Learnability ,"If the application uses a disk cache, it also registers with the Disk Cleanup utility.",,,
Usability,Learnability ,The application does not install icons to the Windows desktop without the user's permission.,,,
Usability,Learnability ,The application works correctly if the user increases the size of the default font.,,,
Usability,Learnability ,The application's uninstall process leaves no remaining files or registry entries other than files created by the user.,,,
Usability,Learnability ,The application has its own database connection user id and password for security purpose.,,,
Usability,Learnability ,"The database connection string, user id, password and other connection details are configurable.",,,
Usability,Learnability ,Back end jobs are installed with minimum number of steps.,,,
Usability,Learnability ,"Schedulers are installed with minimum number of steps. If many schedulers are involved, then installation of these is automated.",,,
Usability,Operability,"Interface with other applications are automated, they don't require manual intervention for communicating to each other.",,,
Usability,Operability,Master data are configurable using Admin options to the extent possible.,,,
Usability,Operability,"XML and other file inputs are in application specific folder, created during installation, not manual creation. If this file input is from another application/interface, then the path is configurable.",,,
Usability,Operability,User-generated data files are stored by default in the My Documents folder or a specific folder within application folder which need not be created by user manually.,,,
Usability,Operability,The application does not write files to the root of the hard disk.,,,
Usability,Operability,"Mail server configuration doesn't require code change, it is configurable externally.",,,
Usability,Operability,"If the application is highly database driven, then stored procedures are used for communicating to database.",,,
Usability,Operability,The installation guideline provides the Hardware/Software specifications as per requirement.,,,
Usability,Operability,"The required supporting DLLs are installed along with main, single installable.",,,
Usability,Operability,The stored procedures are installed along with database using specific database server restore command/s with minimal steps.,,,
Usability,Operability,Does Standard page header is used in all the pages?,,,
Usability,Operability,Is Header Contains Application Name?,,,
Usability,Operability,Is Header Contains User Information?,,,
Usability,Operability,"Is Header Contains Common links - Logout, Change Password, Update Email Id, Home , ",,,
Usability,Operability,Is Header contains Company Logo?,,,
Usability,Operability,Is screen background is uniform across the pages?,,,
Usability,Operability,Does all windows have consistent look and feel?,,,
Usability,Operability,Does all dialog boxes have consistent look and feel?,,,
Usability,Operability,"Does Left & right margins of the controls, starting positions from top, in the screen are same and these margins are consistent on all the screens?",,,
Usability,Operability,Is label fonts are uniform across pages and appropriate font is assigned based on significance/type of label?,,,
Usability,Operability,Whether graphics add to page loading time heavily?,,,
Usability,Operability,Whether graphics are in eye-tiring color?,,,
Usability,Operability,Whether graphics/icons are intuitive/self-explanatory?,,,
Usability,Operability,Whether graphics are of appropriate height/width?,,,
Usability,Operability,"Does command buttons have similar size and shape, and same font & font size?",,,
Usability,Operability,"Are row-column headers (in tables/grids) are uniform in color, font, case?",,,
Usability,User Error Protection,"Is alignment of column headers, row headers, values are uniform across pages in tables and grids?",,,
Usability,User Error Protection,Whether tables/grids are placed in proper positions?,,,
Usability,User Error Protection,"Are buttons placed uniformly in all screens? Example: Save button may be common in all places; it should be of same look and should be in same position in all screens.",,,
Usability,User Error Protection,Are all character or alphanumeric fields left justified? This is the default unless otherwise specified.,,,
Usability,User Error Protection,Are all numeric fields right justified? This is the default unless otherwise specified.,,,
Usability,User Error Protection,Whether all controls have proper title based on functionality they do?,,,
Usability,User Error Protection,Is command/option button has proper names? In case of short names is proper help is given?,,,
Usability,User Error Protection,"Does separate labels are used to explain functionality when buttons are self-explanatory? (Example – when button has search caption, no separate label is required)",,,
Usability,User Error Protection,Does drop down has huge list of data?,,,
Usability,User Error Protection,Does selection of first item in drop down by default is consciously done based on relevance/requirement?,,,
Usability,User Error Protection,"Does drop down are populated uniformly? Example: One drop down has value selected by default. Another has ‘***’ as first entry’. Another has ‘Select’ as first entry.",,,
Usability,User Error Protection,Does sorting the drop down list is done based on relevance/requirement? (Alphabetic sorting is the default unless otherwise specified),,,
Usability,User Error Protection,"If on selection of an item from combo the page is to be refreshed with related data, then it should be done on click of combo. After selection from combo, if we are displaying new page, then use a Go button or Submit button. Whether this is taken care?",,,
Usability,User Error Protection,List boxes-multiple selection is allowed based on requirement/relevance?,,,
Usability,User Error Protection,"In a page, does all-important data in screen available without scrolling?",,,
Usability,User Error Protection,Is horizontal scrolling is avoided to maximum extent?,,,
Usability,User Error Protection,Is scrolling is given for tables/grids based on amount of data?,,,
Usability,User Error Protection,Is it required to scroll page for every scroll of grid? ,,,
Usability,User Error Protection,"When there is scrolling, whether the page/table/grid headers are also scroll? (This makes user to miss header information)",,,
Usability,User Error Protection,Do all the fields edit boxes indicate the number of characters they will hold by their length? e.g. a 30 character field should be a lot longer,,,
Usability,User Error Protection,Do all the fields edit boxes indicate the number of characters they will hold by their length? e.g. a 30 character field should be a lot longer,,,
Usability,User Error Protection,"Is the user required to fix entries, which have failed validation tests?",,,
Usability,User Error Protection,Have any fields got multiple validation rules and if so are all rules being applied?,,,
Usability,User Error Protection,Is all the business validations are taken care?,,,
Usability,User Error Protection,Blank and Non blank data are validated properly using trim?,,,
Usability,User Error Protection,"Does based on filed type, relevant character entry validated?",,,
Usability,User Error Protection,Is email id is validated using standard email format?,,,
Usability,User Error Protection,"If a filed doesn’t take null value in database, then in screen whether it takes null?",,,
Usability,User Error Protection,Are texts are allowed with space as prefix/post-fix in screen? Is ‘yes’ then while inserting into database are they trimmed?,,,
Usability,User Error Protection,If the user enters an invalid value and clicks on the OK button (i.e. does not TAB off the field) is the invalid entry identified and highlighted correctly with an error message?,,,
Usability,User Error Protection,Is validation consistently applied at screen level unless specifically required at field level?,,,
Usability,User Error Protection,"After validation, cursor focus given for respective field?",,,
Usability,User Error Protection,Mandatory fields are indicated?,,,
Usability,User Error Protection,Do all mandatory fields require user input (is there any check to see that the fields indicated as mandatory are not accepting blank entries)?,,,
Usability,User Error Protection,"Is validation messages are given one after the other so that user has to correct one by one as they come up or user will understand at once what are wrong? (Default is to validate together, unless specified)",,,
Usability,User Interface,"User enters all data and submits the page. Now one of the validations is failed. With error message, whether previously entered values get cleared?",,,
Usability,User Interface,The control goes to server in web application depending on specific requirement. The response time is within specified time as per requirement.,,,
Usability,User Interface,Whether validation messages are appearing at eye-catching place?,,,
Usability,User Interface,Does user need to scroll to see validation/error message?,,,
Usability,User Interface,Whether validation messages are appearing at same place except for exceptional cases (preferably at LHS top corner after header)?,,,
